{
  "$schema": "https://json-schema.org/draft/2020-12/schema",
  "$id": "https://nino-agent.local/schemas/evaluation-suite.schema.json",
  "title": "Nino Agent Skill Evaluation Suite",
  "type": "object",
  "additionalProperties": false,
  "required": ["id", "version", "skill_id", "description", "derived_from", "cases"],
  "properties": {
    "$schema": { "type": "string" },
    "id": { "type": "string", "pattern": "^[a-z][a-z0-9.-]+$" },
    "version": { "type": "string", "pattern": "^[0-9]+\\.[0-9]+\\.[0-9]+$" },
    "skill_id": { "type": "string", "pattern": "^[a-z][a-z0-9.-]+$" },
    "description": { "type": "string", "minLength": 1 },
    "derived_from": {
      "type": "array",
      "minItems": 1,
      "uniqueItems": true,
      "items": { "type": "string", "minLength": 1 }
    },
    "cases": {
      "type": "array",
      "minItems": 1,
      "items": { "$ref": "#/$defs/case" }
    }
  },
  "$defs": {
    "case": {
      "type": "object",
      "additionalProperties": false,
      "required": ["id", "category", "tags", "prompt", "derived_from", "expected"],
      "properties": {
        "id": { "type": "string", "pattern": "^[a-z][a-z0-9.-]+$" },
        "category": {
          "enum": ["scope", "clarification", "order-query", "aggregate", "anomaly", "boundary"]
        },
        "tags": {
          "type": "array",
          "minItems": 1,
          "uniqueItems": true,
          "items": { "type": "string", "minLength": 1 }
        },
        "prompt": { "type": "string", "minLength": 1 },
        "derived_from": {
          "type": "array",
          "minItems": 1,
          "uniqueItems": true,
          "items": { "type": "string", "minLength": 1 }
        },
        "expected": { "$ref": "#/$defs/expected" }
      }
    },
    "expected": {
      "type": "object",
      "additionalProperties": false,
      "required": ["status", "skill_id", "dispatch", "answer_facts"],
      "properties": {
        "status": { "enum": ["completed", "failed", "cancelled"] },
        "skill_id": { "type": ["string", "null"] },
        "dispatch": { "type": "boolean" },
        "required_tools": {
          "type": "array", "uniqueItems": true,
          "items": { "type": "string", "minLength": 1 }, "default": []
        },
        "forbidden_tools": {
          "type": "array", "uniqueItems": true,
          "items": { "type": "string", "minLength": 1 }, "default": []
        },
        "required_references": {
          "type": "array", "uniqueItems": true,
          "items": { "type": "string", "minLength": 1 }, "default": []
        },
        "max_model_calls": { "type": "integer", "minimum": 0 },
        "answer_facts": {
          "type": "array",
          "items": {
            "type": "array", "minItems": 1, "uniqueItems": true,
            "items": { "type": "string", "minLength": 1 }
          }
        }
      }
    }
  }
}
